<?xml version="1.0" encoding="UTF-8"?>
<proveidors xmlns:xsi="http://www.w3.org/2001/XMLSchema-instance" xsi:noNamespaceSchemaLocation="proveidors.xsd">
	<proveidor>
		<codi>P01</codi>
		<nom>Gemma</nom>
		<adreca>c/prineu</adreca>
		<poblacio>Girona</poblacio>
		<cp>17070</cp>
	</proveidor>
	<proveidor>
		<codi>P02</codi>
		<nom>Mariel</nom>
		<adreca>c/pau</adreca>
		<poblacio>Girona</poblacio>
		<cp>17001</cp>
	</proveidor>
	<proveidor>
		<codi>P03</codi>
		<nom>Harlequin</nom>
		<adreca>c/president</adreca>
		<poblacio>Girona</poblacio>
		<cp>17005</cp>
	</proveidor>
	<proveidor>
		<codi>P04</codi>
		<nom>Peroni</nom>
		<adreca>c/palau</adreca>
		<poblacio>Girona</poblacio>
		<cp>17071</cp>
	</proveidor>
	<proveidor>
		<codi>P05</codi>
		<nom>Mimic</nom>
		<adreca>c/pla√ßa</adreca>
		<poblacio>Girona</poblacio>
		<cp>17002</cp>
	</proveidor>
</proveidors>
